TÍTULO,AUTORAS,INSTITUCIÓN ,AÑO,ÁREA STEM,CATEGORÍA,LINK,,,,,,,,,,,,,,,,,,,
Construcción de Política Pública para incrementar la participación de las mujeres en el área STEM,Investigadoras de la Universidad Católica Boliviana San Pablo,Universidad Católica Boliviana San Pablo,2021,STEM,Paper escrito por mujeres STEM,https://portal.scz.ucb.edu.bo/public/Imagenes/General/2023/Infografia2.pdf,,,,,,,,,,,,,,,,,,,
Investigación sobre el rol de las mujeres en áreas STEM,Mary Cruz De Urioste,Universidad Privada de Santa Cruz de la Sierra (UPSA),2020,STEM,Paper escrito por mujeres STEM,https://www.upsa.edu.bo/es/noticias-upsa/1627-investigacion-sobre-rol-de-las-mujeres-en-areas-stem,,,,,,,,,,,,,,,,,,,
Relación entre la inclusión y el abandono de mujeres en carreras STEM,Investigadoras de la Universidad Católica Boliviana San Pablo,Universidad Católica Boliviana San Pablo,2020,STEM,Paper escrito por mujeres STEM,https://www.scielo.org.bo/scielo.php?pid=s2071-081x2020000200009&script=sci_arttext,,,,,,,,,,,,,,,,,,,
La realidad de las mujeres bolivianas en carreras STEM,Investigadoras de la Universidad Católica Boliviana San Pablo,Universidad Católica Boliviana San Pablo,2020,STEM,Paper escrito por mujeres STEM,https://1library.co/article/realidad-mujeres-bolivianas-carreras-stem.zlg4l5x6,,,,,,,,,,,,,,,,,,,
Investigación sobre representaciones sociales de las mujeres en áreas STEM de Bolivia,Mariana Santa Cruz,Universidad Católica Boliviana San Pablo,2020,STEM,Paper escrito sobre mujeres en STEM,https://sce.bo/investigacion-sobre-el-rol-de-las-mujeres-en-areas-stem/,,,,,,,,,,,,,,,,,,,
Impacto de las políticas públicas en la inclusión de mujeres en STEM en Bolivia,Investigadoras de la Universidad Católica Boliviana San Pablo,Universidad Católica Boliviana San Pablo,2021,STEM,Paper escrito por mujeres STEM,https://portal.scz.ucb.edu.bo/es/vlir_proyectos_programa,,,,,,,,,,,,,,,,,,,
Laboratoria: Empoderando a mujeres en tecnología,Mariana Costa Checa y equipo,Laboratoria,2014,Tecnología,Proyectos STEM liderados por mujeres,https://www.laboratoria.la,,,,,,,,,,,,,,,,,,,
Estudio sobre la brecha de género en el sector tecnológico boliviano,Investigadoras de la Universidad Privada Boliviana,Universidad Privada Boliviana,2021,Tecnología,Paper escrito sobre mujeres en STEM,https://www.upb.edu/,,,,,,,,,,,,,,,,,,,
Análisis de la participación femenina en carreras de ingeniería en Bolivia,Investigadoras de la Universidad Mayor de San Andrés,Universidad Mayor de San Andrés,2019,Ingeniería,Paper escrito por mujeres STEM,https://www.umsa.bo/,,,,,,,,,,,,,,,,,,,
Programa de mentoría para mujeres en ciencias exactas en Bolivia,Investigadoras de la Universidad Autónoma Gabriel René Moreno,Universidad Autónoma Gabriel René Moreno,2020,Ingeniería,Proyectos STEM liderados por mujeres,https://www.uagrm.edu.bo/,,,,,,,,,,,,,,,,,,,
"Mapping Women STEM Initiatives in Latin American Countries: Bolivia, Brazil and Peru",Luciana Bolan Frigo y equipo,SpringerLink,2024,Matemáticas,Paper escrito sobre mujeres en STEM,https://link.springer.com/chapter/10.1007/978-3-031-54256-5_38,,,,,,,,,,,,,,,,,,,
Participación de las mujeres en áreas STEM en Bolivia,Investigadoras de la Universidad Católica Boliviana San Pablo,Universidad Católica Boliviana San Pablo,2020,Matemáticas,Trabajos STEM,https://stemsantacruz.com/,,,,,,,,,,,,,,,,,,,
Estrategias para mitigar reducciones por deficiente calidad de servicio comercial en distribución de electricidad,Lena Vargas Espinoza,UMSA,2022,Ingeniería,Paper escrito por mujeres STEM,http://repositorio.umsa.bo/xmlui/handle/123456789/30875,,,,,,,,,,,,,,,,,,,
"Dimensionamiento de sistemas de puesta a tierra para subestaciones eléctricas, según la Norma IEEE-80, aplicando el Software ETAP",Ros Mery Gonzales Zamora,UMSA,2024,Ingeniería,Paper escrito por mujeres STEM,http://repositorio.umsa.bo/xmlui/handle/123456789/37336,,,,,,,,,,,,,,,,,,,
Implementación de un programa computacional para el cálculo de tensiones eléctricas en redes de distribución mediante el método de los tramos,Magali Apaza Ochoa,UMSA,2021,Ingeniería,Paper escrito por mujeres STEM,http://repositorio.umsa.bo/xmlui/handle/123456789/36474,,,,,,,,,,,,,,,,,,,
Estudio de resistividad de terrenos a partir de la configuración método Wenner para construcción de estaciones satelitales de regasificación en catorce poblaciones,Regina Callata Condori ,UMSA,2021,Ingeniería,Paper escrito por mujeres STEM,http://repositorio.umsa.bo/xmlui/handle/123456789/36445,,,,,,,,,,,,,,,,,,,
Ahorro energético en iluminación del área de competencia de la piscina olímpica de Sucre mediante luminarias tipo LED,Denisse Erika Mejía Alanez,UMSA,2020,Ingeniería,Paper escrito por mujeres STEM,http://repositorio.umsa.bo/xmlui/handle/123456789/31898,,,,,,,,,,,,,,,,,,,
Estudio comparativo de tecnologías de recolección de aguas negras entre alcantarillado por gravedad y alcantarillado al vacio,Maria Teresa Escobar Aguilar ,UMSA,2023,Ingeniería,Paper escrito por mujeres STEM,http://repositorio.umsa.bo/xmlui/handle/123456789/33652,,,,,,,,,,,,,,,,,,,
"Modelamiento BIM de una edificación de 6 niveles con los componentes arquitectonico, estructural, hidrosanitario, eléctrico y gas con openbuilding",Maria Elena Huanca Cabeza,UMSA,2022,Ingeniería,Paper escrito por mujeres STEM,http://repositorio.umsa.bo/xmlui/handle/123456789/38979,,,,,,,,,,,,,,,,,,,
Análisis y evaluación del comportamiento físico-mecánico de asfalto modificado con látex natural obtenido de la Amazonía Boliviana,Dayanara Danalit Cruz Poma y Liz Mariela Asunción Yanaguaya Tambo,UMSA,2021,Ingeniería,Paper escrito por mujeres STEM,http://repositorio.umsa.bo/xmlui/handle/123456789/38977,,,,,,,,,,,,,,,,,,,
"Análisis de la variabilidad en el módulo resiliente, mejorando la plasticidad de un suelo arcilloso para su uso en la subrasante de un pavimento rígido",Daniela Michele Cortez Aguirre ,UMSA,2019,Ingeniería,Paper escrito por mujeres STEM,http://repositorio.umsa.bo/xmlui/handle/123456789/34676,,,,,,,,,,,,,,,,,,,
Sistema prototipo de registro y seguimiento de activos basado en la tecnología de identificación por radiofrecuencia - RFID Aplicación: Activos y equipos de laboratorio en Ingeniería Electrónica de la UMSA,Alba Esther Espejo Velasco ,UMSA,2021,Ingeniería,Paper escrito por mujeres STEM,http://repositorio.umsa.bo/xmlui/handle/123456789/36411,,,,,,,,,,,,,,,,,,,
Diseño de un espirómetro con el sensor TF800WA para evaluar la capacidad pulmonar de pacientes. Aplicación para el Instituto Nacional de Salud Ocupacional,Alcira Elena Alcón Muñecas,UMSA,2021,Ingeniería,Paper escrito por mujeres STEM,http://repositorio.umsa.bo/xmlui/handle/123456789/35694,,,,,,,,,,,,,,,,,,,
Integración de dispositivos de seguridad sobre una plataforma IoT para el IEA.,María Cecilia Ballesteros Gonzales,UMSA,2023,Ingeniería,Paper escrito por mujeres STEM,http://repositorio.umsa.bo/xmlui/handle/123456789/35042,,,,,,,,,,,,,,,,,,,
Estudio de una Red (SDN) con el Protocolo Openflow y el Controlador RYU,Elizabeth Vino Duran,UMSA,2019,Ingeniería,Paper escrito por mujeres STEM,http://repositorio.umsa.bo/xmlui/handle/123456789/34665,,,,,,,,,,,,,,,,,,,
Descripción del proceso de extracción asistida por radiación.,Hilda Alanoca Aduviri,UMSA,2024,Ingeniería,Paper escrito por mujeres STEM,http://repositorio.umsa.bo/xmlui/handle/123456789/38257,,,,,,,,,,,,,,,,,,,
Desarrollo de un biocomposito soportado en una columna de lecho fijo para el tratamiento de D.A.M. caso Milluni,Jhoseline Carla Arroa Guachalla,UMSA,2021,Ingeniería,Paper escrito por mujeres STEM,http://repositorio.umsa.bo/xmlui/handle/123456789/36759,,,,,,,,,,,,,,,,,,,
Restructuración del área de diseño y desarrollo de la División líquidos de SOALPRO S.R.L.,Teresa Loyola Huanca Calle,UMSA,2023,Ingeniería,Paper escrito por mujeres STEM,http://repositorio.umsa.bo/xmlui/handle/123456789/36299,,,,,,,,,,,,,,,,,,,
Estudio básico para la determinación de las condiciones de operación para la extracción del aceite esencial de Myrcianthes pseudomato (D. Legrand) McVaugh,Ana Gabriela Hilari Calisaya,UMSA,2020,Ingeniería,Paper escrito por mujeres STEM,http://repositorio.umsa.bo/xmlui/handle/123456789/35288,,,,,,,,,,,,,,,,,,,
Análisis matemático cualitativo del modelo SIR epidemiológico,Ximena Rosario Copa Huanca,UMSA,2023,Matemáticas,Paper escrito por mujeres STEM,http://repositorio.umsa.bo/xmlui/handle/123456789/33829,,,,,,,,,,,,,,,,,,,
División simple y justa del cuadrado unitario,Carla Maldonado Ivankovik,UMSA,2021,Matemáticas,Paper escrito por mujeres STEM,http://repositorio.umsa.bo/xmlui/handle/123456789/28276,,,,,,,,,,,,,,,,,,,
Ecuaciones integrales de Fredholm y Volterra asociada a ecuaciones diferenciales,Danitza Miriam Quispe Ortiz,UMSA,2021,Matemáticas,Paper escrito por mujeres STEM,http://repositorio.umsa.bo/xmlui/handle/123456789/26661,,,,,,,,,,,,,,,,,,,
Una caracterización de operadores diferenciales,Adriana Miriam Mallea Morales,UMSA,1996,Matemáticas,Paper escrito por mujeres STEM,http://repositorio.umsa.bo/xmlui/handle/123456789/26416,,,,,,,,,,,,,,,,,,,
Teoremas de descomposición de Weyl y Levi,Gabriela Claudia Calamani Mamani,UMSA,2020,Matemáticas,Paper escrito por mujeres STEM,http://repositorio.umsa.bo/xmlui/handle/123456789/25010,,,,,,,,,,,,,,,,,,,
Criterios de Cartan para la clasificación de Álgebras de Lie solubles y semisimples,Anahí Jessica Yujra Mamani,UMSA,2018,Matemáticas,Paper escrito por mujeres STEM,http://repositorio.umsa.bo/xmlui/handle/123456789/23711,,,,,,,,,,,,,,,,,,,
Grupo simpléctico,Jacqueline Mónica Ramirez,UMSA,2013,Matemáticas,Paper escrito por mujeres STEM,http://repositorio.umsa.bo/xmlui/handle/123456789/17791,,,,,,,,,,,,,,,,,,,
El Teorema de Órbitas,Paola Geovanna Patzi Aquino,UMSA,2012,Matemáticas,Paper escrito por mujeres STEM,http://repositorio.umsa.bo/xmlui/handle/123456789/17789,,,,,,,,,,,,,,,,,,,
Transformada discreta de Fourier en el tratamiento de señales,Verónica Callisaya Cantuta,UMSA,2011,Matemáticas,Paper escrito por mujeres STEM,http://repositorio.umsa.bo/xmlui/handle/123456789/17775,,,,,,,,,,,,,,,,,,,
Modelo de optimización de procesos operativos de tecnologías de la información durante procesos electorales,Brenda Isabel Fernández Robles,UMSA,2020,Tecnología,Paper escrito por mujeres STEM,http://repositorio.umsa.bo/xmlui/handle/123456789/28782,,,,,,,,,,,,,,,,,,,
Modelo de inteligencia de negocios para el manejo de estadística en la venta directa de valores Caso: Banco Central de Bolivia,Viviana Luque Salluco,UMSA,2020,Tecnología,Paper escrito por mujeres STEM,http://repositorio.umsa.bo/xmlui/handle/123456789/27699,,,,,,,,,,,,,,,,,,,
Modelo de seguridad para el desarrollo de software,Maribel Pachacuti Blanco,UMSA,2020,Tecnología,Paper escrito por mujeres STEM,http://repositorio.umsa.bo/xmlui/handle/123456789/27697,,,,,,,,,,,,,,,,,,,
Modelo de transformación digital para mejorar los procesos educativos en educación superior aplicando Big Data,Shirley Solange Salazar Montoya,UMSA,2020,Tecnología,Paper escrito por mujeres STEM,http://repositorio.umsa.bo/xmlui/handle/123456789/27693,,,,,,,,,,,,,,,,,,,
Estudio del impacto de la acreditación en el aprovechamiento Académico de la Carrera de Ingeniería Agronómica por el Metodo de suavización exponencial de holt winters,Thelma Paola Aramayo Muñoz,UMSA,2018,Ciencia,Paper escrito por mujeres STEM,http://repositorio.umsa.bo/xmlui/handle/123456789/17617,,,,,,,,,,,,,,,,,,,
"Características y determinantes del empleo en el sector informal en Bolivia, Aplicación del Modelo Logit Multinomial",Elizabeth Sonia Nina Siñani,UMSA,2018,Ciencia,Paper escrito por mujeres STEM,http://repositorio.umsa.bo/xmlui/handle/123456789/17615,,,,,,,,,,,,,,,,,,,
"Aplicación practica del análisis de correspondencia simple, en la interpretación de la gravedad de accidentes de trabajo en Bolivia: caso Instituto Nacional de Salud Ocupacional",Alizon Emilze Perez Butron,UMSA,2014,Ciencia,Paper escrito por mujeres STEM,http://hdl.handle.net/123456789/5332,,,,,,,,,,,,,,,,,,,
"TRANSDISCIPLINARY CO-CREATION OF FOOD SOVEREIGNTY. A CASE STUDY IN TIRAQUE, BOLIVIA",Helga Gruberg Cazon,UCB,2019,Ingeniería,Paper escrito por mujeres STEM,http://www.scielo.org.bo/scielo.php?script=sci_abstract&pid=S1683-07892019000300003&lng=es&nrm=iso&tlng=en,,,,,,,,,,,,,,,,,,,
EXERGY ANALYSIS OF A SOLAR HEATING AND COOLING SYSTEM THAT USES PHASE CHANGE MATERIALS. PCMSOL PROJECT,"Diana Maldonado, Marcos Luján, Sabina Rosiek, Javier Batlles, Svetlana Ushak",UCB,2019,Ingeniería,Paper colaborativo mujeres STEM,http://www.scielo.org.bo/scielo.php?script=sci_abstract&pid=S1683-07892019000300002&lng=es&nrm=iso&tlng=en,,,,,,,,,,,,,,,,,,,
Más de 250 jóvenes bolivianas se gradúan con habilidades tecnológicas del Programa Mujeres 360,NA ,Mujeres 360 ,2024,Tecnología,Nota de prensa ,https://mujeres360.org/tecnologia/mas-de-250-jovenes-bolivianas-se-graduan-con-habilidades-tecnologicas-del-programa-mujeres-360/,,,,,,,,,,,,,,,,,,,
"Allison Silva, la boliviana que lidera una fundación que motiva e impulsa a emprendedores",Paúl Granillo,Unitel,2023,Tecnología,Nota de prensa escrito por hombre pero de mujer,https://noticias.unitel.bo/sociedad/allison-silva-la-boliviana-que-lidera-una-fundacion-que-motiva-e-impulsa-a-emprendedores-YD7522706,,,,,,,,,,,,,,,,,,,
Allison Silva gana el premio de Impacto del Global Competitiveness Leadership Program en Estados Unidos,NA ,Fundación emprende futuro,NA ,Tecnología,Nota de prensa ,https://emprenderfuturo.org/bolivia-emprende/allison-silva-gana-el-premio-de-impacto-del-global-competitiveness-leadership-program-en-estados-unidos/,,,,,,,,,,,,,,,,,,,
Se inicia nueva versión del Taller 24E Plus: Empoderando a mujeres con herramientas financieras,NA,Fundación emprende futuro,NA ,Tecnología,Nota de prensa ,https://emprenderfuturo.org/bolivia-emprende/se-inicia-nueva-version-del-taller-24e-plus-empoderando-a-mujeres-con-herramientas-financieras/,,,,,,,,,,,,,,,,,,,
Se inauguró AWE Bolivia en La Paz con 85 emprendedoras,NA ,Fundación emprende futuro,NA ,Tecnología,Nota de prensa ,https://emprenderfuturo.org/noticias/se-inauguro-awe-bolivia-en-la-paz-con-85-emprendedoras/,,,,,,,,,,,,,,,,,,,
Mujeres 360: Se gradúa la nueva generación de mujeres con talento en tecnología,NA ,Fundación emprende futuro,NA ,Tecnología,Nota de prensa ,https://emprenderfuturo.org/noticias/mujeres-360-se-gradua-la-nueva-generacion-de-mujeres-con-talento-en-tecnologia/,,,,,,,,,,,,,,,,,,,
"Más mujeres ingresan al sector tecnológico, pero persisten los desafíos",NA ,El deber ,2024,STEM,Nota de prensa ,https://eldeber.com.bo/educacion-y-sociedad/mas-mujeres-ingresan-al-sector-tecnologico-pero-persisten-los-desafios_394565,,,,,,,,,,,,,,,,,,,
Ingenieras made in Bolivia: Rompiendo Barreras y Construyendo el Futuro,NA ,El deber ,2024,STEM,Nota de prensa ,https://eldeber.com.bo/te-puede-interesar/ingenieras-made-in-bolivia-rompiendo-barreras-y-construyendo-el-futuro_387403,,,,,,,,,,,,,,,,,,,
¿Cómo motivar a las niñas y adolescentes a explorar carreras STEM?,NA ,El deber ,2024,STEM,Nota de prensa ,https://eldeber.com.bo/te-puede-interesar/ingenieras-made-in-bolivia-rompiendo-barreras-y-construyendo-el-futuro_387403,,,,,,,,,,,,,,,,,,,
En el Fab Lab Santa Cruz desarrollan un biodigestor para mejorar la calidad de vida en el área rural,NA ,El deber ,2024,STEM,Nota de prensa ,https://eldeber.com.bo/educacion-y-sociedad/en-el-fab-lab-santa-cruz-desarrollan-un-biodigestor-para-mejorar-la-calidad-de-vida-en-el-area-rural_382281,,,,,,,,,,,,,,,,,,,
Solo el 35% de los estudiantes de carreras tecnológicas son mujeres,NA ,Los tiempos Bolivia ,2023,STEM ,Nota de prensa ,https://www.lostiempos.com/tendencias/interesante/20231010/solo-35-estudiantes-carreras-tecnologicas-son-mujeres,,,,,,,,,,,,,,,,,,,
Allison Silva: “Podríamos fortalecer la educación en tecnología y el aprendizaje del inglés”,Daymira Barriga Velarde ,Los tiempos Bolivia ,2022,STEM ,Nota de prensa ,https://www.lostiempos.com/oh/entrevista/20220516/allison-silva-podriamos-fortalecer-educacion-tecnologia-aprendizaje-del,,,,,,,,,,,,,,,,,,,
"Iniciativas, programas y concursos acercan a las niñas con la tecnología",Cindy Soliz Villegas,Los tiempos Bolivia ,2021,STEM ,Nota de prensa ,https://www.lostiempos.com/doble-click/vida-tecnologia/20210422/iniciativas-programas-concursos-acercan-ninas-tecnologia,,,,,,,,,,,,,,,,,,,
Ofrecen a mujeres 100 becas en ciencias y tecnología,Catherine Camacho,Los tiempos Bolivia ,2019,STEM,Nota de prensa ,https://www.lostiempos.com/tendencias/educacion/20190820/ofrecen-mujeres-100-becas-ciencias-tecnologia,,,,,,,,,,,,,,,,,,,
Niñas y jóvenes informáticas vencen insultos masculinos,NA ,Los tiempos Bolivia ,2019,Tecnología,Nota de prensa ,https://www.lostiempos.com/tendencias/tecnologia/20190429/ninas-jovenes-informaticas-vencen-insultos-masculinos,,,,,,,,,,,,,,,,,,,
Motivar a las niñas en ciencias y tecnología es un reto social,Catherine Camacho,Los tiempos Bolivia ,2019,Tecnología,Nota de prensa ,https://www.lostiempos.com/tendencias/educacion/20190605/motivar-ninas-ciencias-tecnologia-es-reto-social,,,,,,,,,,,,,,,,,,,
UTILIZANDO METODOLOGÍA MIXTA EN ESTUDIOS DE INVESTIGACIÓN SOBRE EQUIDAD DE GÉNERO EN CARRERAS DE SISTEMAS Y TECNOLOGÍA,Indira Guzman,NA ,NA,Tecnología,Presentación investigación,https://warwick.ac.uk/fac/sci/eng/research/enhancing_research_culture/events_reimagining_a_stem_research_culture/americas/guzman_presentation_women_in_it_inwes_v1.pdf,,,,,,,,,,,,,,,,,,,
"Critical Analysis of Stakeholders in the Municipality of Tarija, Bolivia, in Search of Strategies for Adequate Water Governance to Implement Reverse Osmosis as an Alternative for Generating Safe Water for Its Inhabitants","Esteban Manuel Villena-Martínez , Paola Andrea Alvizuri-Tintaya,Vanesa Gladys Lo-Iacono-Ferreira ,Jaime Lora-García,Juan Ignacio Torregrosa-López,Lorena Sánchez Barrero ,Alejandra Leigue Fernández ,Paul D’Abzac ","Centro de Investigación de Ingeniería y Ciencias Exactas, Departamento de Ciencias Básicas e Infraestructura, Universidad Católica Boliviana “San Pablo”, Tarija, Bolivia, Centro de Investigación en Agua, Energía y Sostenibilidad, Universidad Católica Boliviana “San Pablo”, La Paz, Bolivia, Project Management, Innovation and Sustainability Research Center (PRINS), Alcoy Campus, Universitat Politècnica de València, Plaza Ferrándiz y Carbonell, s/n, E-03690 Alcoy, Spain, Research Institute for Industrial, Radiophysical and Environmental Safety (ISIRYM), Universitat Politècnica de València, Plaza Ferrándiz y Carbonell, s/n, E-03690 Alcoy, Spain, Centro de Investigación de Ciencias Exactas e Ingeniería, Universidad Católica Boliviana “San Pablo”, Cochabamba, Bolivia",2023,STEM,Paper colaborativo mujeres STEM,https://www.mdpi.com/2073-4441/15/17/3164,,,,,,,,,,,,,,,,,,,
"Contamination of Water Supply Sources by Heavy Metals: The Price of Development in Bolivia, a Latin American Reality","Paola Andrea Alvizuri-Tintaya ,Esteban Manuel Villena-Martínez ,Nithya Avendaño-Acosta ,Vanesa Gladys Lo-Iacono-Ferreira,Juan Ignacio Torregrosa-López,Jaime Lora-García 
","Centro de Investigación en Agua, Energía y Sostenibilidad, Universidad Católica Boliviana “San Pablo”, La Paz, Bolivia, Project Management, Innovation and Sustainability Research Center (PRINS), Universitat Politècnica de València, Alcoy Campus, Plaza Ferrándiz y Carbonell, s/n, 03690 Alcoy, Spain, Departamento de Ingeniería y Ciencias Exactas, Universidad Católica Boliviana “San Pablo”, Tarija, Bolivia, Research Institute for Industrial, Radiophysical and Environmental Safety (ISIRYM), Universitat Politècni-ca de València, Plaza Ferrándiz y Carbonell, s/n, 03690 Alcoy, Spain",2022,STEM,Paper colaborativo mujeres STEM,https://www.mdpi.com/2073-4441/14/21/3470?utm_campaign=releaseissue_waterutm_medium=emailutm_source=releaseissueutm_term=titlelink160,,,,,,,,,,,,,,,,,,,
"Reverse Osmosis Modeling Study of Lead and Arsenic Removal from Drinking Water in Tarija and La Paz, Bolivia","Esteban Manuel Villena-Martínez,Paola Andrea Alvizuri-Tintaya ,Jaime Lora-García ,Juan Ignacio Torregrosa-López ,Vanesa Gladys Lo-Iacono-Ferreira","
Departamento de Ingeniería y Ciencias Exactas, Universidad Católica Boliviana “San Pablo”, Tarija, Bolivia, Project Management, Innovation and Sustainability Research Center (PRINS), Universitat Politècnica de València, Alcoy Campus, Plaza Ferrándiz y Carbonell, s/n, E-03690 Alcoy, Spain, Centro de Investigación en Agua, Energía y Sostenibilidad, Universidad Católica Boliviana “San Pablo”, La Paz, Bolivia, Research Institute for Industrial, Radiophysical and Environmental Safety (ISIRYM), Universitat Politècnica de València, Plaza Ferrándiz y Carbonell, s/n, E-03690 Alcoy, Spain",2022,STEM ,Paper colaborativo mujeres STEM,https://www.mdpi.com/2227-9717/10/9/1889,,,,,,,,,,,,,,,,,,,
A Comparative Analysis of Statistical Models and Mathematics in Reverse Osmosis Evaluation Processes as a Search Path to Achieve Better Efficiency,"Esteban Manuel Villena-Martínez ,Paola Andrea Alvizuri-Tintaya ,Jaime Lora-Garcia ,Juan Ignacio Torregrosa-López ,Vanesa Gladys Lo-Iacono-Ferreira ","Departamento de Ingeniería y Ciencias Exáctas, Universidad Católica Boliviana “San Pablo”, Tarija, Bolivia,Project Management, Innovation and Sustainability Research Center (PRINS), Alcoy Campus, Universitat Politècnica de València, Plaza Ferrándiz y Carbonell, s/n, E-03690 Alcoy, Spain, Centro de Investigación en Agua, Energía y Sostenibilidad, Universidad Católica Boliviana “San Pablo”, La Paz, Bolivia,Research Institute for Industrial, Radiophysical and Environmental Safety (ISIRYM), Alcoy Campus, Universitat Politècnica de València, Plaza Ferrándiz y Carbonell, s/n, E-03690 Alcoy, Spain
",2022,STEM ,Paper colaborativo mujeres STEM,https://www.mdpi.com/2073-4441/14/16/2485?utm_campaign=releaseissue_waterutm_medium=emailutm_source=releaseissueutm_term=doilink84,,,,,,,,,,,,,,,,,,,
Variación de la calidad del agua en la Cuenca Katari (Bolivia) y su relación con las actividades antrópicas,"d'Abzac, Paul Foulon, Agathe Schneider, Caroline
Escobar Camacho, Ivan Federico Xavier
Alvizuri-Tintaya, Paola Andrea",CIDIP 2024 ,2024,STEM ,Paper colaborativo mujeres STEM,http://dspace.aeipro.com/xmlui/bitstream/handle/123456789/3637/AT04-023_24.pdf?sequence=1&isAllowed=y,,,,,,,,,,,,,,,,,,,
La realidad de las mujeres bolivianas en carreras STEM,"Vidfa Carolina Garvizu Auza, Susana Gloria Vargas Mendieta",UCB,2021,STEM,Paper escrito por mujeres STEM,https://1library.co/article/realidad-mujeres-bolivianas-carreras-stem.zlg4l5x6,,,,,,,,,,,,,,,,,,,
"¿Por qué tan pocas mujeres en Bolivia optan por carreras universitarias relacionadas con STEM (Ciencia, Tecnología, Ingeniería y Matemáticas) y qué podemos hacer para cambiar esta situación?","Boris Branisa, Patricia Cabero, Indira Guzmán",,2020,STEM,Paper colaborativo mujeres STEM,https://ideas.repec.org/p/iad/sdsnwp/1020.html,,,,,,,,,,,,,,,,,,,
Participación de las mujeres en áreas ‘STEM’,NA,UPSA,2022,STEM,Nota de prensa,https://www.upsa.edu.bo/es/ultimas-noticias/1791-participacion-de-las-mujeres-en-areas-stem,,,,,,,,,,,,,,,,,,,
"¿Por qué hay tan pocas mujeres en ciencias, tecnología, ingeniería y matemáticas?",Julia Martínez Murillo,Fundación ICEES,2024,STEM,Nota de prensa,https://www.icees.org.bo/2024/03/por-que-hay-tan-pocas-mujeres-en-ciencias-tecnologia-ingenieria-y-matematicas/,,,,,,,,,,,,,,,,,,,
Mujeres en la política científica del Estado Plurinacional de Bolivia,Nelly Balda Cabello,UMSA,2024,STEM,Paper escrito por mujeres STEM,https://jcomsoc.ucb.edu.bo/a/article/download/1311/1229?inline=1,,,,,,,,,,,,,,,,,,,
El aporte de las mujeres ingenieras al desarrollo del país,COORDINACIÓN REGIONAL DE INVESTIGACIÓN SANTA CRUZ,UCB ,NA,Ingeniería,Nota de prensa,https://portal.scz.ucb.edu.bo/public/Imagenes/General/2023/01_NOTA_DE_PRENSA_1.pdf,,,,,,,,,,,,,,,,,,,
Bolivia celebró el Día Internacional de la Mujer Matemática,COORDINACIÓN REGIONAL DE INVESTIGACIÓN SANTA CRUZ,UCB ,2024,Matemáticas,Nota de prensa,https://portal.scz.ucb.edu.bo/public/Imagenes/General/2023/03_NOTA_DE_PRENSA_3.pdf,,,,,,,,,,,,,,,,,,,
Docentes de distintas universidades enriquecen la propuesta de política pública para incrementar la participación efectiva de las mujeres en las áreas STEM en Bolivia,COORDINACIÓN REGIONAL DE INVESTIGACIÓN SANTA CRUZ,UCB ,NA,STEM,Nota de prensa,https://portal.scz.ucb.edu.bo/public/Imagenes/General/2023/05_NOTA_DE_PRENSA_5.pdf,,,,,,,,,,,,,,,,,,,
"Escuela, reproducciones colectivas y una nueva visión en camino",COORDINACIÓN REGIONAL DE INVESTIGACIÓN SANTA CRUZ,UCB ,NA,STEM,Nota de prensa,https://portal.scz.ucb.edu.bo/public/Imagenes/General/2023/07_NOTA_DE_PRENSA_7.pdf,,,,,,,,,,,,,,,,,,,
"Presentación de resultados del proyecto: Construcción de política pública para una participación efectiva de las mujeres en los campos de la ciencia, tecnología, ingeniería y matemáticas en Bolivia",COORDINACIÓN REGIONAL DE INVESTIGACIÓN SANTA CRUZ,UCB ,NA,STEM,Nota de prensa,https://portal.scz.ucb.edu.bo/public/Imagenes/General/2023/02_NOTA_DE_PRENSA_2.pdf,,,,,,,,,,,,,,,,,,,
Natalia Montellano investiga las propiedades nutricionales y biológicas de doce frutos chiquitanos,COORDINACIÓN REGIONAL DE INVESTIGACIÓN SANTA CRUZ,UCB ,NA,Ingeniería,Nota de prensa,https://portal.scz.ucb.edu.bo/public/Imagenes/General/2023/04_NOTA_DE_PRENSA_4.pdf,,,,,,,,,,,,,,,,,,,
